UC1_Create_Database
mysql> create database payroll_service_new
    -> ;
Query OK, 1 row affected (1.20 sec)

mysql> show databases;
+---------------------+
| Database            |
+---------------------+
| admission           |
| airline             |
| batch11             |
| bridgelabz          |
| customer            |
| database1           |
| database2           |
| db                  |
| demo                |
| employee            |
| employee1           |
| employees           |
| foodydata           |
| gms                 |
| hp_mgmt_db          |
| information_schema  |
| inventoryshop       |
| library_management  |
| mohan               |
| mysql               |
| payroll_service     |
| payroll_service_new |
| payrolldata         |
| performance_schema  |
| placementfx         |
| shubham             |
| simplestudentm      |
| spareparts          |
| student             |
| student_database    |
| studentdatabase     |
| superline           |
| sys                 |
| test                |
| test1               |
| userdb              |
| usermaster          |
| weighing_scale      |
+---------------------+
38 rows in set (0.11 sec)

UC2_Create_Table

mysql> use payroll_service_new
Database changed
mysql> create table employee_payroll(
    -> id int unsigned not null auto_increment,
    -> name varchar(100) not null,
    -> salary double not null,
    -> start date not null,
    -> primary key(id));
Query OK, 0 rows affected (17.62 sec)

mysql> desc employee_payroll;
+--------+--------------+------+-----+---------+----------------+
| Field  | Type         | Null | Key | Default | Extra          |
+--------+--------------+------+-----+---------+----------------+
| id     | int unsigned | NO   | PRI | NULL    | auto_increment |
| name   | varchar(100) | NO   |     | NULL    |                |
| salary | double       | NO   |     | NULL    |                |
| start  | date         | NO   |     | NULL    |                |
+--------+--------------+------+-----+---------+----------------+
4 rows in set (0.86 sec)

UC3_Insert_Database

mysql> insert into employee_payroll(name,salary,start)values ('Bill',1000000.00,'2010-10-30'),('Tersia',2000000.00,'2019-11-13'),('Charlie',3000000.00,'2020-05-21');
Query OK, 3 rows affected (0.15 sec)
Records: 3  Duplicates: 0  Warnings: 0

UC4_Retrieve_Database

mysql> select * from employee_payroll
    -> ;
+----+---------+---------+------------+
| id | name    | salary  | start      |
+----+---------+---------+------------+
|  1 | Bill    | 1000000 | 2010-10-30 |
|  2 | Tersia  | 2000000 | 2019-11-13 |
|  3 | Charlie | 3000000 | 2020-05-21 |
+----+---------+---------+------------+
3 rows in set (0.11 sec)


UC5_Retrieve_Salary_Database

mysql> select salary from employee_payroll where name = 'Bill';
+---------+
| salary  |
+---------+
| 1000000 |
+---------+
1 row in set (0.43 sec)

mysql> select salary from employee_payroll where start between cast('2018-01-01' as date) and date (now());
+---------+
| salary  |
+---------+
| 2000000 |
| 3000000 |
+---------+
2 rows in set (0.08 sec)

mysql> select * from employee_payroll where start between cast('2018-01-01' as date) and date(now());
+----+---------+---------+------------+
| id | name    | salary  | start      |
+----+---------+---------+------------+
|  2 | Tersia  | 2000000 | 2019-11-13 |
|  3 | Charlie | 3000000 | 2020-05-21 |
+----+---------+---------+------------+
2 rows in set (0.00 sec)

mysql> select * from employee_payroll where start between cast('2020-01-01' as date) and date (now());
+----+---------+---------+------------+
| id | name    | salary  | start      |
+----+---------+---------+------------+
|  3 | Charlie | 3000000 | 2020-05-21 |
+----+---------+---------+------------+
1 row in set (0.00 sec)


UC6_Adding_Gender_To_The_Table

mysql> alter table employee_payroll add gender char(1) after name;
Query OK, 0 rows affected (3.59 sec)
Records: 0  Duplicates: 0  Warnings: 0

mysql> desc employee_payroll;
+--------+--------------+------+-----+---------+----------------+
| Field  | Type         | Null | Key | Default | Extra          |
+--------+--------------+------+-----+---------+----------------+
| id     | int unsigned | NO   | PRI | NULL    | auto_increment |
| name   | varchar(100) | NO   |     | NULL    |                |
| gender | char(1)      | YES  |     | NULL    |                |
| salary | double       | NO   |     | NULL    |                |
| start  | date         | NO   |     | NULL    |                |
+--------+--------------+------+-----+---------+----------------+
5 rows in set (0.35 sec)

mysql> update employee_payroll set gender = 'M' where name = 'Bill' or name = 'Charlie';
Query OK, 2 rows affected (0.19 sec)
Rows matched: 2  Changed: 2  Warnings: 0

mysql> select * from employee_payroll;
+----+---------+--------+---------+------------+
| id | name    | gender | salary  | start      |
+----+---------+--------+---------+------------+
|  1 | Bill    | M      | 1000000 | 2010-10-30 |
|  2 | Tersia  | NULL   | 2000000 | 2019-11-13 |
|  3 | Charlie | M      | 3000000 | 2020-05-21 |
+----+---------+--------+---------+------------+
3 rows in set (0.07 sec)

mysql> update employee_payroll set gender = 'F' where name = 'Tersia';
Query OK, 1 row affected (0.04 sec)
Rows matched: 1  Changed: 1  Warnings: 0

mysql> select * from employee_payroll;
+----+---------+--------+---------+------------+
| id | name    | gender | salary  | start      |
+----+---------+--------+---------+------------+
|  1 | Bill    | M      | 1000000 | 2010-10-30 |
|  2 | Tersia  | F      | 2000000 | 2019-11-13 |
|  3 | Charlie | M      | 3000000 | 2020-05-21 |
+----+---------+--------+---------+------------+
3 rows in set (0.07 sec)

